city,special provider,provider type,name,specialties,address
上海,否,私立医疗机构,上海极宝儿科门诊部,儿科，中医，牙科,儿科，中医，牙科
郑州,否,齿科诊所,郑州赛德口腔医院,修复,修复
成都,否,私立医疗机构,成都高新企鹅综合门诊部,内科，口腔,内科，口腔
成都,否,私立医疗机构,成都爱丽美妇产医院,妇产科,妇产科
武汉,否,公立医院,武汉协和医院国际门诊,全科,全科
武汉,否,公立医院,武汉市普仁医院,外科，血液内科,外科，血液内科
广州,否,私立医疗机构,广州新宁门诊,内外科、儿科、妇科、皮肤科、医学检验、预防保健、医学影像,内外科、儿科、妇科、皮肤科、医学检验、预防保健、医学影像
上海,否,私立医疗机构,和生堂,中医内科、妇科、儿科、肿瘤科、皮肤科和针灸科、推拿科、伤骨科,中医内科、妇科、儿科、肿瘤科、皮肤科和针灸科、推拿科、伤骨科
南京,否,私立医疗机构,南京江宁顾泽门诊部,儿科、全科、心理门诊、妇产科、中医科医疗美容科、康复科等,儿科、全科、心理门诊、妇产科、中医科医疗美容科、康复科等
沈阳,否,私立医疗机构,沈阳美德因诊所,全科；,全科；
廊坊,否,私立医疗机构,河北燕达陆道培医院,血液科,河北省廊坊市燕郊开发区思菩兰路西侧
成都,否,私立医疗机构,成都顾连康复医院,康复,成都市成华区雅砻江路 (东客站西广场旁)
北京,否,齿科诊所,浦京口腔门诊,齿科,齿科
北京,否,私立医疗机构,北京企鹅诊所,全科、儿科,全科、儿科
东莞,否,公立医院,康华医院华心楼,心血管内科,心血管内科
深圳,否,私立医疗机构,深圳市大族都安健康管理有限公司泰然门诊部,妇科、泌尿外科、中医妇科、内科,妇科、泌尿外科、中医妇科、内科
杭州,否,公立医院,杭州第七人民医院西溪谷门诊部*,睡眠障碍，心理咨询,睡眠障碍，心理咨询
大连,否,私立医疗机构,大连维特奥国际医院,否,否
北京,否,私立医疗机构,中康美复康复诊所,康复医学科,康复医学科
无锡,否,私立医疗机构,无锡明慈心血管病医院,内科、心内科、心外科、内分泌科、康复科,内科、心内科、心外科、内分泌科、康复科
温州,否,齿科诊所,牙博士温州新城机构,齿科,齿科
温州,否,齿科诊所,温州鹿城牙博士口腔门诊部有限公司,齿科,齿科
上海,否,私立医疗机构,曜影医疗-前滩世贸门诊部,全科、内科、普外科、物理治疗、心理科、儿科、眼科、皮肤医美,全科、内科、普外科、物理治疗、心理科、儿科、眼科、皮肤医美
沈阳,否,公立医院,沈阳积水潭医院,脊柱外科，手外科，矫形科，创伤骨科，烧伤整形科，心内科,脊柱外科，手外科，矫形科，创伤骨科，烧伤整形科，心内科
上海,否,私立医疗机构,嘉会国际医院,肿瘤科、妇女医学、儿科、骨科和运动医学,肿瘤科、妇女医学、儿科、骨科和运动医学
北京,否,私立医疗机构,北京优合复兴门诊所,全科,全科
北京,否,私立医疗机构,北京迦南门诊部,肿瘤科,肿瘤科
烟台,否,公立医院,烟台市口腔医院*,齿科,齿科
烟台,否,公立医院,烟台市口腔医院幸福分院*,齿科,齿科
烟台,否,公立医院,烟台市口腔医院开发区分院*,齿科,齿科
烟台,否,公立医院,烟台市口腔医院烟大分院*,齿科,齿科
烟台,否,公立医院,烟台市口腔医院福山分院*,齿科,齿科
烟台,否,公立医院,烟台市口腔医院卧龙分院*,齿科,齿科
深圳,否,私立医疗机构,唯儿诺-深圳海岸城门诊部,儿科、儿童体检，儿童眼科，儿童齿科，中医,儿科、儿童体检，儿童眼科，儿童齿科，中医
深圳,否,私立医疗机构,唯儿诺-深圳宝安门诊部,儿科、儿童体检，儿童齿科，中医,深圳市宝安区新安街道熙龙湾花园商业办公楼(国际西岸大厦)101B
深圳,否,私立医疗机构,唯儿诺-深圳蛇口门诊部,儿科、儿童体检，儿童齿科，中医,深圳市南山区招商街道工业四路四号八号铺
杭州,否,私立医疗机构,唯儿诺-杭州庆春门诊部,儿科、儿童体检，儿童齿科，中医,儿科、儿童体检，儿童齿科，中医
杭州,否,私立医疗机构,杭州全程健康医疗门诊部,心内科、呼吸内科、消化内科、普外科、肿瘤内科、肿瘤外科、妇科、骨科,心内科、呼吸内科、消化内科、普外科、肿瘤内科、肿瘤外科、妇科、骨科
武汉,否,私立医疗机构,武汉第一口腔医院江大医院,齿科,齿科
深圳,否,齿科诊所,深圳瑞尔诊所-卓悦汇诊所,美容修复、隐形正畸、无痛种植、儿童口腔 Cosmetic Dentistry/Invisalign/,美容修复、隐形正畸、无痛种植、儿童口腔 Cosmetic Dentistry/Invisalign/
深圳,否,齿科诊所,友睦口腔-南山招商局广场门诊,齿科,齿科
深圳,否,齿科诊所,友睦口腔-南山欢乐海岸门诊,齿科,齿科
深圳,否,齿科诊所,友睦口腔-福田华强北门诊,齿科,齿科
广州,否,齿科诊所,友睦口腔-广州侨鑫国际门诊,齿科,齿科
上海,否,公立医院,复旦大学附属肿瘤医院质子重离子医院*,肿瘤科,肿瘤科
成都,否,私立医疗机构,成都百汇馨康,全科，心内科,全科，心内科
北京,否,私立医疗机构,北京凤凰联和温榆门诊部,家庭医生（全科/内科),北京市顺义区天竺镇丽来花园一区一号（温榆广场）L1-11
北京,否,私立医疗机构,北京凤凰联和银峰诊所,家庭医生（全科/内科),家庭医生（全科/内科)
北京,否,公立医院,北京市回民医院*,眼科、心血管科、脑病科,眼科、心血管科、脑病科
南昌,n/a,公立医院,南昌市第一医院,n/a,n/a
南昌,n/a,齿科诊所,南昌瑞尔口腔门诊,n/a,n/a
南昌,n/a,私立医疗机构,南昌三溪堂国医馆,n/a,n/a
北京,否,公立医院,北京协和医院西单院区国际医疗部,"内分泌，乳腺外科，免疫内科,肿瘤内科","内分泌，乳腺外科，免疫内科,肿瘤内科"
上海,否,私立医疗机构,君和堂中医门诊,儿科、妇科、肿瘤科、针推科、内科,儿科、妇科、肿瘤科、针推科、内科
上海,否,私立医疗机构,上海百佳妇产医院,妇产科,妇产科
北京,否,齿科诊所,北京佳美口腔紫竹院诊所,齿科,齿科
北京,否,齿科诊所,北京佳美口腔永定路诊所,齿科,齿科
北京,否,齿科诊所,北京佳美口腔新中街丽德诊所,齿科,齿科
北京,否,齿科诊所,北京佳美口腔望京东路诊所,齿科,齿科
北京,否,齿科诊所,北京佳美口腔三源里诊所,齿科,齿科
北京,否,齿科诊所,北京佳美口腔潘家园诊所,齿科,齿科
北京,否,齿科诊所,北京佳美口腔酒仙桥诊所,齿科,齿科
北京,否,齿科诊所,北京佳美口腔劲松诊所,齿科,齿科
北京,否,齿科诊所,北京佳美口腔金泰桥诊所,齿科,齿科
北京,否,齿科诊所,北京佳美口腔海淀桥诊所,齿科,齿科
北京,否,齿科诊所,北京佳美口腔广渠路诊所,齿科,齿科
北京,否,齿科诊所,北京佳美口腔阜外诊所,齿科,齿科
北京,否,齿科诊所,北京佳美口腔成府路诊所,齿科,齿科
宁波,否,公立医院, 宁波市北仑区人民医院,神经内科、心血管内科,神经内科、心血管内科
杭州,否,公立医院,浙大一院国际医疗门诊部,感染科、血液病科、肾脏病科、消化内科、呼吸内科,感染科、血液病科、肾脏病科、消化内科、呼吸内科
苏州,否,齿科诊所,牙博士湖东机构,n/a,n/a
常熟,否,齿科诊所,牙博士常熟机构,n/a,n/a
昆山,否,齿科诊所,牙博士昆山城区机构,n/a,n/a
无锡,否,私立医疗机构,无锡百佳妇产医院,儿科、妇产科、超声科,儿科、妇产科、超声科
北京,否,齿科诊所,北京拜博融科口腔门诊部,齿科,齿科
广州,否,私立医疗机构,广州卓智诊所,儿科、妇产科、心血管科、中医科,广州市天河区花城大道优托邦东翼二层
深圳,否,私立医疗机构,企鹅杏仁医生深圳诊所,全科、妇科、皮肤科、儿科、内科、中医、日间手术,全科、妇科、皮肤科、儿科、内科、中医、日间手术
广州,否,私立医疗机构,企鹅杏仁医生广州诊所,全科、妇科、皮肤科、儿科、内科、中医、日间手术,全科、妇科、皮肤科、儿科、内科、中医、日间手术
北京,否,私立医疗机构,北京新世纪怡德朝外诊所,"儿内科、儿外科、妇科、儿/成人耳鼻喉、儿/成人皮肤科、小儿呼吸过敏科、儿/成人中医、成人心内科、成人内科、健康体检、儿童精神心理科、儿童保健科 Pediatrics,Pediatric surgical,Gynecology,Pediatric/Adult Otology,Pediatric/Adult dermatology,Pediatric respiratory（Anaphylaxis）,Pediatric/Adult TCM、Pediatric/Adult stomatology、Healthy checkup、Pediatric/Adult Psychopsychology 、Child health care","儿内科、儿外科、妇科、儿/成人耳鼻喉、儿/成人皮肤科、小儿呼吸过敏科、儿/成人中医、成人心内科、成人内科、健康体检、儿童精神心理科、儿童保健科 Pediatrics,Pediatric surgical,Gynecology,Pediatric/Adult Otology,Pediatric/Adult dermatology,Pediatric respiratory（Anaphylaxis）,Pediatric/Adult TCM、Pediatric/Adult stomatology、Healthy checkup、Pediatric/Adult Psychopsychology 、Child health care"
北京,否,私立医疗机构,北京新世纪奥东门诊部,妇科、产科、中医科、成人内科、儿科、保健科、耳鼻喉、眼科、皮科、小儿外科、小儿呼吸科,妇科、产科、中医科、成人内科、儿科、保健科、耳鼻喉、眼科、皮科、小儿外科、小儿呼吸科
青岛,否,私立医疗机构,青岛新世纪妇儿医院有限公司,妇科、产科、儿科,妇科、产科、儿科
长沙,否,齿科诊所,瑞泰科尔雅口腔医院总院,齿科,齿科
长沙,否,齿科诊所,瑞泰科尔雅口腔医院昊天VIP门诊部,齿科,齿科
长沙,否,齿科诊所,瑞泰科尔雅口腔医院西奥VIP门诊部,齿科,齿科
北京,否,齿科诊所,瑞尔齿科双井一轻大厦诊所,齿科,齿科
北京,否,私立医疗机构,北京济爱通惠诊所,胃肠镜,胃肠镜
北京,否,私立医疗机构,北京优和维尔门诊部,n/a,n/a
北京,否,私立医疗机构,北京霍普医院,甲状腺核医学科 Thyroid nuclear medicine,甲状腺核医学科 Thyroid nuclear medicine
上海,否,私立医疗机构,上海睿臻迈医疗中心,内科、中医科、心内专科、骨科专科、妇科专科、皮肤科 Cardiology Medicine Family Medicine Orthopedic Medicine Gynecology,内科、中医科、心内专科、骨科专科、妇科专科、皮肤科 Cardiology Medicine Family Medicine Orthopedic Medicine Gynecology
镇江,否,公立医院,镇江市第一人民医院*,n/a,n/a
上海,否,公立医院,上海市第十人民医院*,n/a,n/a
北京,否,公立医疗机构,中国医学科学院阜外医院特需门诊*（2号楼，近医院东门）,心内科，心外科,心内科，心外科
上海,否,公立医院,复旦大学附属儿科医院 -- 枫林路院区*,神经内科、肾脏内科、康复中心、血液肿瘤中心、心血管中心 ,神经内科、肾脏内科、康复中心、血液肿瘤中心、心血管中心 
上海,否,公立医院,复旦大学附属眼耳鼻喉科医院  --  汾阳路*, 眼科、五官科 , 眼科、五官科 
上海,否,公立医院,复旦大学附属眼耳鼻喉科医院 --  宝庆路*,眼科、五官科 ,眼科、五官科 
上海,否,公立医院,复旦大学附属肿瘤医院*,大肠外科、放射治疗科、胃及软组织外科、胰腺肝胆外科 ,大肠外科、放射治疗科、胃及软组织外科、胰腺肝胆外科 
上海,否,公立医院,上海交通大学医学院附属第九人民医院*,口腔、骨科,口腔、骨科
上海,否,公立医院,上海交通大学医学院附属仁济医院 -- 东院*,消化科、心内科、血液科、风湿病科,消化科、心内科、血液科、风湿病科
上海,否,公立医院,上海交通大学医学院附属仁济医院 -- 西院*,消化科、心内科、血液科、风湿病科,消化科、心内科、血液科、风湿病科
上海,否,公立医院,上海交通大学医学院附属新华医院*,儿科、心血管内科、骨科 ,儿科、心血管内科、骨科 
上海,否,公立医院,上海市第十人民医院 同济大学附属第十人民医院*, 眼科 , 眼科 
上海,否,公立医院,上海市肺科医院*,胸外科、肿瘤科、呼吸科、结核科 ,胸外科、肿瘤科、呼吸科、结核科 
上海,否,公立医院,上海市胸科医院*,胸外科、心血管病 ,胸外科、心血管病 
上海,否,公立医院,上海长海医院*,消化内科、胸心外科、泌尿外科、烧伤外科,消化内科、胸心外科、泌尿外科、烧伤外科
上海,否,公立医院,上海长征医院*,骨科、普外科、消化内科、胸心外科,骨科、普外科、消化内科、胸心外科
上海,否,公立医院,岳阳中西医结合医院 -- 甘河路*,中医妇科、康复科、针灸科、痛风 ,中医妇科、康复科、针灸科、痛风 
上海,否,公立医院,岳阳中西医结合医院 -- 青海路*,中医妇科、康复科、针灸科、痛风 ,中医妇科、康复科、针灸科、痛风 
上海,否,公立医院,中山医院*,呼吸科、普外科、心外科、胸外科,呼吸科、普外科、心外科、胸外科
上海,否,公立医院,上海市第一妇婴保健院特需部*, 妇产科、新生儿科 , 妇产科、新生儿科 
苏州,否,公立医院,苏州大学附属第一医院国际门诊*,血液科、骨外科 ,血液科、骨外科 
苏州,否,公立医院,苏州市立医院特需部*,消化科、产科、新生儿疾病筛查、儿童保健科,消化科、产科、新生儿疾病筛查、儿童保健科
无锡,否,私立医疗机构,无锡凤凰医院*,全科医疗 ,全科医疗 
厦门,否,私立医疗机构,厦门长庚医院*,唇腭裂、乳癌 ,唇腭裂、乳癌 
昆山,否,公立医院,昆山市第一人民医院绿卡门诊*,心血管内科、脑外科、肾内科、手外科、妇产科,心血管内科、脑外科、肾内科、手外科、妇产科
成都,否,公立医院,四川大学华西医院*,呼吸科、泌尿外科、内分泌科、神经内科、胸外科  ,呼吸科、泌尿外科、内分泌科、神经内科、胸外科  
重庆,否,公立医院,陆军军医大第一附属医院（重庆西南医院）*,烧伤科，骨科，神经外科,烧伤科，骨科，神经外科
